Carimbo de data/hora,Nome do influencer,Qual o @ (identifica a rede),Qual a nota desse influ?,Quando trabalhou com esse influ?,Como foi trabalhar com esse influ?,Conselho p/ colegas da área
1/23/25 13:41,cauwave,cauwave,10,2023,errei a nota antes!!! é dez!!!,
1/23/25 13:41,Gabi Brandt,@gabibrandt,1,"Fazem alguns meses. NÃOCUMPRE PRAZO! Péssimacomunicação! Cobra bem caropara não ter compromisso com asentregas.","Não trabalhem, MUITA DOR DECABEÇA",Apenas não
1/23/25 13:41,Felipe Castanhari,@castanhari,3,2020/ 2021,"Não segue briefing, atrasa todos osprazos, se sente a última bolacha dopacote para conteúdos medíocres","quase tive um burnout por contadele, então se for uma pessoadesprendida e tudo, contrata ele"
1/23/25 13:41,Esther Melo,@esthermmelo,10,2023-2025,"A Esther é muito dedicada nosconteúdos, criativa, entrega dentro dosprazos e super compreensiva com osajustes. Assessoria impecável comprazos. O retorno é sempre muito bom",Vale muito a pena
1/23/25 13:41,Samanta Alves,mantaalves,2,Dezembro de 2022,"Desconfortável! Realizamos umatransmissão ao vivo com ela e toda vezque outra mulher entrava ao vivo, aSamantha fazia um escândalo ecomeçava a falar mal das outras para aprodução, sugerindo diversas vezes quesubstituíssem as outras por ela. Criouuma rivalidade feminina da cabeça delae tentou prejudicar várias. Se mostroucolaborativa e disposta com a equipe deprodução mas realmente deixou todosdesconfortáveis com esses comentários","Se forem contratar ela, garantamque ela é a única mulher doprojeto rs"
1/23/25 13:42,Paola Carosella,@paolacarosella,10,2019,"Um amor de pessoa!!! Chegou antes dohorário da gravação, levou seus própriosutensílios e ingredientes, sentouconosco para entender exatamente doque estávamos precisando e, na hora dagravação, foi um show de simpatia eemoção (ela quase chorou dandodepoimento). Antes da diária, chegou aligar pessoalmente pra mim para discutiro briefing.","Recomendo muito. Não sei se aassessoria se mantém a mesma,mas na época foi perfeita,entregou conteúdo e númerosincríveis."
1/23/25 13:43,Juliette,@juliette,10,2024,"Trabalhei com a Juliette na metade de2024 para publi de uma marca. Quandoela chegou ao set de gravação, todosque estavam presentes ficaramchocados com a dedicação e carinhoque a artista teve com todos queestavam lá. Ela basicamente ficou horasconversando com toda a equipe, superamigável. No final tirou foto com cadaum e ainda deu um ingresso do showdela de São João para um fã que estavaesperando ela na saída.","Rentabilidade altíssima, públicoMUITO fiel. As redes da marcabombaram MUITO com os postsda Juliette."
