Carimbo de data/hora,Nome do influencer,Qual o @ (identifica a rede),Qual a nota desse influ?,Quando trabalhou com esse influ?,Como foi trabalhar com esse influ?,Conselho p/ colegas da área
1/23/25 12:57,Raquel Real,@raquelrealoficial,10,2023,"Muito tranquilo, a Raquel é supercriativa, respeita prazos, entede DO's eDON'Ts como ninguém e não tivemosproblemas com refações, ajustes oupedidos que chegaram do cliente deúltimo minuto.","Só vai, trabalho bom, númerosbons e tranquila de lidar."
1/23/25 12:57,Imira de Holanda,@studiom4 - instagram,10,jan.-25,"O que aparece nos vídeos do canal delaé o que ela é: alto astral, boa energia,super didática e criativa. Ajudoubastante a equipe, dando ideias eseguindo o briefing.","Contratem! Entrega tudo e tembons resultados"
1/23/25 12:58,Cafira,@cafira,9,2024,"São umas fofas, a influ e a equipe. Aequipe é meio perdida, às vezes perdemprazos e tal, mas entregam qualidade.","Combinar direitinho prazos emanter ata das reuniões, deixartudo alinhadinho."
1/23/25 12:59,Raquele Cardozo,@raquele.cardozo - instagram,10,2024,"Super tranquila de trabalhar. Entendebem os briefings e está sempre dispostaa auxiliar da melhor forma pra chegarem um resultado legal. Geralmente temuma equipe que contribui na roteirizaçãoe busca sempre entregar seu melhor.","Contratem ela e não searrependam! Precisamos valorizarquem se compromete e querentregar o melhor."
1/23/25 12:59,Gi Lancelotti,gilancelotti,5,2021,"Ela ainda ta com a Ju pedrosa?? PQMEU DEUSSSS! Ela manda áudiobrigaando, falando que a Gi não temagenda que não sei o que, que não vairefazer etc. Muito dificil...",vão passar estresse
1/23/25 13:00,Barbara Carrara,@astrologiadeboah,3,2023,"Toda a negociação foi tranquila. Mas aquerida resolveu abrir concorrência doserviço DO NADA, 10 minutos depois depostar o conteúdo pago. Ela não tinhaintenção nenhuma de abrir agenda delaantes de junho de 2024, mas vendo aprocura pelo serviço a partir da publi, elasimplesmente ""precisou escutar ocoração pra ajudar as pessoas"".",
