Carimbo de data/hora,Nome do influencer,Qual o @ (identifica a rede),Qual a nota desse influ?,Quando trabalhou com esse influ?,Como foi trabalhar com esse influ?,Conselho p/ colegas da área
1/23/25 13:01,Bagi,@bagi,9,2023 e 2024,"Quando a gente pensa eminfluenciadores conectados com agalera gamer e que convertem bem, aBagi é a primeira que vem na mente.Sempre que rola, a gente fecha com ela,porque ela resolve tudo e tá semprepronta pra co-criar, até nas campanhasmais caóticas! Sem falar que a agentedela é super profissional e prestativa",Com certeza!
1/23/25 13:05,Cris Tsuchida,@cristsuchida,10,-,"A CRIS É UM CRISTAL! Supercomprometida: Se envolve no projeto,compreende tudo rápido, dá inputsconstrutivos e manda muito bem nosconteúdos. Dá pra ver que faz combastante carinho e se dedica muito. Opreço dela é ótimo, principalmente pornão ter um público tão grande AINDA.Sem falar que ela tem formação comobiomédica, então sabe muito bem doque está falando. Entrega muito maisque a maioria das influs de skincare ecom um lugar de fala que poucas tem.","Contratem 1000 vezes!Aproveitem para criar umrelacionamento agora, porquedepois ela vai estourar e ficargigante."
1/23/25 13:05,JanaRosa,janarosa,10,2023 e 2024,"Ela passa uma energia meio caótica,mas no final ela entrega TUDO, além deser super comprometida com os jobs.Das 2x que trabalhei com ela gosteimuito.","Se for publi de beleza e bem-estarela converte. O publico dessesegmento enxerga ela como ref."
1/23/25 13:06,Felipe Amorim,@flipeamorim - insta,10,2025,"Um querido, entregou antes do prazo,seguiu o roteiro e foi super simpático!",Contratem ele sem medo
1/23/25 13:07,Amanda Souza,mandck.s,10,2024,"trabalhei duas vezes com ela e superseguiu o briefing e deu sugestões de co-criação, além de ser super engajada nacomunidade negra e cobra super barato(pelo menos na época em quetrabalhamos juntos)","Vale o investimento, deixem queela participe da co-criação"
