Carimbo de data/hora,Nome do influencer,Qual o @ (identifica a rede),Qual a nota desse influ?,Quando trabalhou com esse influ?,Como foi trabalhar com esse influ?,Conselho p/ colegas da área
1/23/25 12:03,Luara,@luara,10,2024 / 2025,"Fechamos um contrato em 2024 e agoraacabamos de renovar com a Luara. Elavoltou para internet neste último ano etem se dedicado muito, muito criativa,sempre atenta as trends na internet/tiktok - trazendo ótimos resultados!","Podem contratar! Ela é mtocuidadosa com os conteúdos."
1/23/25 12:03,Jana Rosa,@janarosa,10,2018,"É bem comprometida, vibe meio “she’sso crazy” mas completamente dedicadacom as entregas. É profissional, dá boasideias, é experiente e muito educada.",Recomendo
1/23/25 12:05,João Bertoni,ojoaobertoni - ig,10,2024,"Perfeito! Super criativo e sensível, sepegou o job é porque tá a fim de fazer evai entregar de coração. Respeitaprazos e sabe trabalhar muito bem.",Pode confiar 100000%
1/23/25 12:05,Ludmilla,@ludmilla,1,2024 / 2025,"Simplesmente terrível, o time dela étotalmente familiar, zeroprofissionalismo, preço altíssimo prapouca entrega, enchem o saco comajustes bestas e a gata simplesmentetem uma atualização para ajuste da corda pele dela. Nunca mais iremostrabalhar com ela, entrou na nossa listanegra de artistas.","Não vale a pena de formaalguma, mas se quiserem,preparem o bolso, porquesimplesmente o time dela écaríssimo(além de ser umesquema), profissionaisfraquíssimos, demoram demaissspara dar retorno, atrapalhamcronograma, atrasam entregas epor ai vai..."
1/23/25 12:06,Sabrina Sato,@sabrinasato,10,2023,"Ela é realmente diferenciada, muito bemassessorada, tem visão estratégica,comprometimento, educação (falta muitonessa área), entrega além do acordado.Faz publi e algumas entregasespontâneas também.","Super recomendo, muitoprofissional!"
