Carimbo de data/hora,Nome do influencer,Qual o @ (identifica a rede),Qual a nota desse influ?,Quando trabalhou com esse influ?,Como foi trabalhar com esse influ?,Conselho p/ colegas da área
1/23/25 10:31,Isa Scherer,@isascherer,10,2024 o ano inteiro,"ótimo, a assessora é um pouco chata,mas a isa faz conteúdos incríveis eentrega muito resultado em números (demétricas e vendas), vale muito a penamesmo sendo cara","ela envia os conteúdos praaprovação em cima da hora masraramente precisa de refações,então podem ficar tranquilos"
1/23/25 10:32,Jade Picon,@jadepicon,10,"2022, 2023, 2024","Sempre foi incrível, mas melhorou muitodesde que mudou de agência (antestinha um assessor que era chatodemais). Ela entrega conteúdos demuita qualidade, é super atenciosa,querida e preocupada com a marca.Além de entregar muito resultado demétricas e vendas e engajamento com acomunidade dela","É cara, mas vale muito a pena"
1/23/25 10:33,Malu Borges,@maluborgesm,1,2023,"Horrível, chata demais, não aceitarefação, não segue os briefings e do's edon'ts, se preocupa apenas em fazer umconteúdo que viralize na comunidadedela, mas não está nem aí para asnecessidades da marca que a contratoue do briefing que recebeu","Não contratem! Chega de darpalco pra quem não está nem aípro trabalho, ela é zeroprofissional"
1/23/25 10:37,Michel Marques,@graninhas,10,Julho de 2024,"As entregas do @graninhas são feitascom muito capricho e cuidado. Vale oinvestimento pelas possibilidadescriativas que o perfil oferece.","Chamaria o perfil para trabalharalém das entregas em redessociais."
1/23/25 10:37,Mare Sanz,@maresanz,10,2024,"PERFEITA. A gata entende briefingcomo ninguém, é uma queridona etrabalha muito junto",Contratem demais!
1/23/25 10:39,Dudhar,@soududhar (tiktok e instagram),10,2024 e 2025,"APENAS INCRÍVEL, CONTRATEMJOU pRúOb!li cAo d éiv Ra EteAmL  uinmfluae enqcuiaipdeo  dpeo r tudoqauudei oevlais fuaalal .b (aab gaadleeirrao  pperarg purnotdau qzuira al sompueblhliso re d éia s puruau cpoerrt acrr ioa tcivaab neolos  er onteãoiros.cFoarzt alimnk s dee e alas tnroãloo gmiaa ned aasr.s ujunroto k skokbkr)e.  avDidivaa  ddeiv fao.rma orgânica com a marca e o","CONTRATEM. A diva entrega.criatividade, beleza e carisma.Arrisco dizer que vai ser apróxima star de publis bemcriativas e produzidas."
1/23/25 10:40,Giovanna Ferrarezi,giovannaferrarezi,9,1 semestre de 2024,"Ela é a rainha das publis mesmo! MuitoHIPER engajada. Como ela fala decriativa e empenhada, seguiu o roteiroastrologia e tals, o pessoal ve ela nesseredondo e entregou demais",
