Carimbo de data/hora,Nome do influencer,Qual o @ (identifica a rede),Qual a nota desse influ?,Quando trabalhou com esse influ?,Como foi trabalhar com esse influ?,Conselho p/ colegas da área
1/23/25 13:43,Gabriela Paveloski,@gabipaveloski - tiktok,10,jan.-25,"A Gabi entrega tudo com muito amor ecarinho, pensa muito bem em como vaientregar de maneira natural e faz tudode bom grado",CONTRATEM!!!!!!!!!!!!
1/23/25 13:43,Viih Tube,viihtube,4,2021,"Esnobe. Não olhou na cara de ninguémda produção. Só ficava olhando para ocelular.",
1/23/25 13:43,Amanda Britto,@amandabritto,10,muitas ocasiões,"Perfeita e maravilhosa. Criativa, cumpreprazos, entrega com qualidade e é umaótima parceira pra se ter a longo prazo","Aproveitem ela para além doCarnaval"
1/23/25 13:44,Giovanna Ewbank,gioewbank,7,2021-2023,"Vc tem que se adaptar a agenda dela,totalmente. Isso inclui, levar o set juntocom ela pra gravar pq ela está no Rio,ou em Noronha. Uma vez ela vinha aténós e ela tinha que chegar no set paraensaiar e atrasou 1hora, por isso nãoconseguimos fazer ensaio nenhum. Eela tem a agenda limitada. Mesmoassim a gata faz bem o serviço.Entregou, mesmo sem ensaio. Sacarápido as coisas, vende bem o produto,tem desenvoltura e responde ao roteiro.","Se prepare com muitaantecedencia para a agenda dela.E não assuste com imprevistos.Pelo menos ela não deixou namão. Sabe vender."
1/23/25 13:45,Ivete Sangalo,@ivetesangalo,8,2024,"A Ivete é absurda de rápida, bastapassar o texto uma vez com ela, pra eladesembuchar tudo. Só é quaseimpossível conseguir agenda com ela,maquiador só poder ser o exclusivo dela(super caro) e, normalmente, asgravações precisam ser feitas emSalvador.","Grana no bolso, cronogramaapertado e vai!"
1/23/25 13:45,Mc Daniel,Mc Daniel,2,nov.-24,"Insuportável, quer chamar atenção otempo todo, acha que é superengraçado, não respeita um horário enenhum combinado.",Tenha paciência...
1/23/25 13:45,Jessica Diniz,@jedinizm,10,2024,"Ela é bastante prática, faz a própriainterface com o cliente. Participa doprocesso criativo e dá muitas ideiasadaptadas ao briefing. Entregaredondinha, sem erros e com folga doprazo estipulado.",Contratem sem medo.
1/23/25 13:45,alexia hahn,alexia hahn,1,prefiro nao falar,"horrivel, recebeu os produtos e sumiu.Nunca postou nada e nem deu resposta.Extremamente antiprofissional emimada.","furada, não contratem"
