Carimbo de data/hora,Nome do influencer,Qual o @ (identifica a rede),Qual a nota desse influ?,Quando trabalhou com esse influ?,Como foi trabalhar com esse influ?,Conselho p/ colegas da área
1/23/25 12:39,Virei Adulto,@vireiadulto,7,2023,"Esforçado, participativo mas tem umbafo que da uma desanimada.",
1/23/25 12:40,Thallita Xavier,@thallitaxavier - IG,3,2023-2024,"A situação está bastante difícil. Apessoa está com atitudes extremamenteinflamadas, não cumpre prazos efrequentemente cria desculpas para nãoseguir os cronogramas acordados.Mostra resistência a ajustes ealterações, além de se ausentar porlongos períodos. Também temdemonstrado falta de educação egrosseria. Não é receptiva a sugestõese, sempre que confrontada, tentajustificar suas atitudes com a condiçãode morar em um local menos favorecido,algo que não parece ser a principalcausa do problema.","Não contratem, a não ser queseja uma entrega muito orgânicaonde ela possa fazer o quequiser."
1/23/25 12:41,Isadora Cruz,isadoracruz,1,2024,"Pior influenciadora que já trabalhei navida, atrasou entregas, ficavaregravando coisas de formadesnecessárias, foi a influ que deu maistrabalho durante toda minha carreira",FUJAM
1/23/25 12:43,Tata / Pod Delas,@tata / @poddelas,4,2024,"Ela não lê briefing, a equipe nãorespeita acordos e prazos. É realmenteum tormento pq a má vontade éescancarada.","Façam reunião diretamente comela, assim ela fica ciente dobriefing de fato. Fiquem no pé daequipe dela, pois eles são bemcomplicados de trabalhar."
