Carimbo de data/hora,Nome do influencer,Qual o @ (identifica a rede),Qual a nota desse influ?,Quando trabalhou com esse influ?,Como foi trabalhar com esse influ?,Conselho p/ colegas da área
1/23/25 13:37,"Patricia Pomerantzeff(Doma Arquitetura)",@domaaraquitetura,2.0,2022/2023,"Horroroso. Ela nao cumpre com ocombinado, pede permuta deabsolutamente tudo, se acha, e éextremamente antipatica. A assessoradela é outra grosseira. Deixou o clientena mao pedindo uma permuta CARA eno fim não creditou em nenhum lugar.","NAO faça permuta e bote tudoTUDO em contrato"
1/23/25 13:38,Lucca Najar,@luccanajar,10.0,2023/2024/2025,"Gostamos muito de trabalhar com ele,não conhecia antes mas trabalhando metornei fã, o conteúdo é criativo, bonito eentrega muito rápido, todas as vezesque a agencia teve problemas ouatrasamos algo ele conseguiu suprir eentregar com qualidade mesmo em umtempo curto","recomendo se querem umaentrega rápida e bonita, o preçojusto pelo numero e conversão, osclientes sempre ficam muito deboca aberta quandoapresentamos os conteudos"
1/23/25 13:38,Jean Langbecker,@jeanlangbecker,10.0,2024,"Jean é maravilhoso! Já fiz 2 campanhascom ele de tão foda a entrega. Ele faz oroteiro, edita com qualidade profissional,ajusta o som e a imagem. Fora quesempre antes do prazo entregava tudopra validar, refazia e ja deixavaagendado. A performance dele é MUITOboa, tem muita educação e carisma.","Recomendo dar espaço pra ele tbcontribuir e fazer do jeito que maisvai dar resultado. Deixamos fazerda forma que queria e o resultadofoi mt surpreendente."
1/23/25 13:38,Gaules,@Gaules,1.0,2023 e 2024,"Péssimo, horrível.Gaulês não participa de reuniões,mesmo sendo requerido em contrato.Sempre com uma desculpa que está emlMivaer,c oaum qouse u emsatá r eeumn ioãuot rcao rmeu 1n5iã doi,a os ud eqanuete ceesdtáê enmcia v, iaognedme .foi dito pelocomercial que ele participaria eO time que negocia, organiza e planeja descubro pelo Instagram da esposa deleé ótimo e super atencioso, mas ele em que ele estava viajando. Na hora envio osi não.","Se você não ficar atento, aentrega além de não acontecer nadata estipulada, ela é postergadaaTe rmev ienlfilau ednecleia. dPoarleasv rmase ndoor es queaetnetnredgimamen mtoe dlheoler  e""O d eGmaoun és trammincaoisn itnrotelárevessl,e n.em mesmo nossadiretora consegue""."
1/23/25 13:38,Thali e Gabi,@twolostkids,9.0,"2021, 2022, 2023","não sabia que ele estava em viagem.AU men atrbesguar déo i!mpecável assim como aqualidade criativa. Cumprem os prazose possuem uma comunicação excelente.","Valor alto que precisa seravaliado muito bem pq o alcancee engajamento tem caído e estãocom a audiência bem segmentada"
,,,,,Queria dar nota 1M.,
