Carimbo de data/hora,Nome do influencer,Qual o @ (identifica a rede),Qual a nota desse influ?,Quando trabalhou com esse influ?,Como foi trabalhar com esse influ?,Conselho p/ colegas da área
1/23/25 13:58,Barbara Gutierrez,@bahgutierrez,10,2024,"Muito responsável e simpática. Sabeinterpretar o briefing e entregar umconteúdo criativo, que conversa bemcom a audiência dela.","Podem contratar, vale a pena."
1/23/25 13:58,Helen Ramos,ahelenramos,1,2024,"HORRIVEL, não segue briefing, acreditoque também nao lê hahahah assessoriapessima também, meio soberbos. elacurte passar o ar de ser descolada masna realidade é só mais uma rica metidaa ser da galera. não respeita a agênciae além de tudo é mercenária","dependendo da marca, naocontratem, é péssima e nao valeoq cobra"
1/23/25 13:59,O Jean Luca,ojeanluca,10,Novembro de 2024,"Foi uma experiência ótima! Entregoutudo no prazo e deu ideias criativas.Fizemos uma campanha de natal praum banco e a entrega dele foi bemprofissional e o cliente amou","Pode contratar. Ele não é nomebatido nas campanhas e trabalhamuito bem além de entregarnúmeros"
1/23/25 14:00,Theago Neiva,theagoneiva,10,2024,"Falei direto com a assessora delechamada Letícia muito profissional esimpática, soube negociar e era bemrápida para envio de contratos erelatórios e prazos da entrega!",10-out.
1/23/25 14:00,Duh Marinho,@duhmarinho,2,2024,"Péssimo. Não aceitava sugestõescriativas, mentia descaradamente, tomsarcástico todo o tempo, esquecia oshorarios e dias de gravação",
1/23/25 14:00,Renata Santti,@renatasantti,10,2022 e 2023,"Trabalhar com a Renata é simplesmenteincrível. Sempre solícita, segue obriefing e troca com a equipe osmelhores caminhos e sempre tratandotodo mundo com muita educação. Amananger dela trabalha junto e ajudaem tudo. Muito tranquilo","Chamem a Renata para outrosjobs além de makes, ela merecemuito ganhar mais notoriedade,ainda mais agora que vai ser mãe"
1/23/25 14:00,Coringa,Loud_victor,3,2023,"Atrasa muuuuuito! Equipe dele é muitoruim, arrogante, está lá fazendo favor,não segue roteiro e depois que o jobsaiu com erro, vem com desculpa.","Bom volume e um públicobastante fiel. Mas não converte."
1/23/25 14:01,Carol e Evyton,@casaldorolee -ig,10,Dezembro de 24,"Foi PERFEITO! São super prestativos,aAt eenqtuoips ea on ãbori eéf imngu ieto a gorsa npdraez, omsa. sE stãoasepmespre disOs gaatro dse s tpuodsotão mosse,m cpormep erseteãnos livos, pró aravilhosos!igados no",Podem contratar!
1/23/25 14:01,Xuxa,@xuxameneghel,10,2024,"Ela sempre foi o profissionalismo emtrabalho. Foi incrível trabalhar com ele epessoa. Muito profissional, muitosempre que for necessário irei retomar!engajada, bem assessorada, supercomprometida, mas gosta de dar pitaco.",
